[
  {
    "id": "26346",
    "date": "2024-05-01",
    "city": "Barrow",
    "venue": "Fred Ipalook Elementary School",
    "category": "music",
    "title": "2024 Commencement",
    "time": "3p-5p",
    "ticketUrl": "https://www.facebook.com/events/1184597849388188/?acontext=%7B%22event_action_history%22%3A%5b%7B%22mechanism%22%3A%22search_results%22%2C%22surface%22%3A%22bookmark_search%22%7D%5d%2C%22ref_notif_type%22%3Anull%7D",
    "cost": ""
  },
  {
    "id": "43690",
    "date": "2026-04-29",
    "city": "Barrow",
    "venue": "Tuzzy Consortium Library",
    "category": "community",
    "title": "Teen Art Saturdays",
    "time": "3p-5p",
    "ticketUrl": "https://www.facebook.com/events/2272721403136396/2280216412386895/?acontext=%7B%22event_action_history%22%3A%5b%7B%22mechanism%22%3A%22surface%22%2C%22surface%22%3A%22permalink%22%7D%5d%2C%22ref_notif_type%22%3Anull%7D",
    "cost": ""
  },
  {
    "id": "43920",
    "date": "2026-05-06",
    "city": "Barrow",
    "venue": "Tuzzy Consortium Library",
    "category": "community",
    "title": "Teen Art Saturdays",
    "time": "3p-5p",
    "ticketUrl": "https://www.facebook.com/events/2272721403136396/2280216409053562/?acontext=%7B%22event_action_history%22%3A%5b%7B%22extra_data%22%3A%22%22%2C%22mechanism%22%3A%22surface%22%2C%22surface%22%3A%22permalink%22%7D%2C%7B%22extra_data%22%3A%22%22%2C%22me",
    "cost": ""
  },
  {
    "id": "44141",
    "date": "2026-05-13",
    "city": "Barrow",
    "venue": "Tuzzy Consortium Library",
    "category": "community",
    "title": "Storytime & Crafternoon",
    "time": "1p-3p",
    "ticketUrl": "https://www.facebook.com/events/2139971986761030/2139972016761027/",
    "cost": ""
  },
  {
    "id": "44359",
    "date": "2026-05-20",
    "city": "Barrow",
    "venue": "Tuzzy Consortium Library",
    "category": "community",
    "title": "Storytime & Crafternoon",
    "time": "1p-3p",
    "ticketUrl": "https://www.facebook.com/events/2139971986761030/2139971993427696/?active_tab=about",
    "cost": ""
  },
  {
    "id": "44576",
    "date": "2026-05-27",
    "city": "Barrow",
    "venue": "Tuzzy Consortium Library",
    "category": "community",
    "title": "Storytime & Crafternoon",
    "time": "1p-3p",
    "ticketUrl": "https://www.facebook.com/events/2139971986761030/2139972020094360/?active_tab=about",
    "cost": ""
  },
  {
    "id": "44806",
    "date": "2026-06-03",
    "city": "Barrow",
    "venue": "Tuzzy Consortium Library",
    "category": "community",
    "title": "Storytime & Crafternoon",
    "time": "1p-3p",
    "ticketUrl": "https://www.facebook.com/events/2139971986761030/2139972013427694/?acontext=%7B%22event_action_history%22%3A%5b%7B%22mechanism%22%3A%22surface%22%2C%22surface%22%3A%22permalink%22%7D%5d%2C%22ref_notif_type%22%3Anull%7D",
    "cost": ""
  },
  {
    "id": "45070",
    "date": "2026-06-10",
    "city": "Barrow",
    "venue": "Tuzzy Consortium Library",
    "category": "community",
    "title": "Storytime & Crafternoon",
    "time": "1p-3p",
    "ticketUrl": "https://www.facebook.com/TuzzyConsortiumLibrary/",
    "cost": ""
  },
  {
    "id": "45343",
    "date": "2026-06-17",
    "city": "Barrow",
    "venue": "Tuzzy Consortium Library",
    "category": "community",
    "title": "Storytime & Crafternoon",
    "time": "1p-3p",
    "ticketUrl": "https://www.facebook.com/TuzzyConsortiumLibrary/",
    "cost": ""
  },
  {
    "id": "45655",
    "date": "2026-06-24",
    "city": "Barrow",
    "venue": "Tuzzy Consortium Library",
    "category": "community",
    "title": "Storytime & Crafternoon",
    "time": "1p-3p",
    "ticketUrl": "https://www.facebook.com/TuzzyConsortiumLibrary/",
    "cost": ""
  },
  {
    "id": "45996",
    "date": "2026-07-01",
    "city": "Barrow",
    "venue": "Tuzzy Consortium Library",
    "category": "community",
    "title": "Storytime & Crafternoon",
    "time": "1p-3p",
    "ticketUrl": "https://www.facebook.com/TuzzyConsortiumLibrary/",
    "cost": ""
  },
  {
    "id": "46274",
    "date": "2026-07-08",
    "city": "Barrow",
    "venue": "Tuzzy Consortium Library",
    "category": "community",
    "title": "Storytime & Crafternoon",
    "time": "1p-3p",
    "ticketUrl": "https://www.facebook.com/TuzzyConsortiumLibrary/",
    "cost": ""
  },
  {
    "id": "46551",
    "date": "2026-07-15",
    "city": "Barrow",
    "venue": "Tuzzy Consortium Library",
    "category": "community",
    "title": "Storytime & Crafternoon",
    "time": "1p-3p",
    "ticketUrl": "https://www.facebook.com/TuzzyConsortiumLibrary/",
    "cost": ""
  },
  {
    "id": "46845",
    "date": "2026-07-18",
    "city": "Barrow",
    "venue": "Tuzzy Consortium Library",
    "category": "community",
    "title": "Storytime & Crafternoon",
    "time": "1p-3p",
    "ticketUrl": "https://www.facebook.com/TuzzyConsortiumLibrary/",
    "cost": ""
  },
  {
    "id": "47026",
    "date": "2026-07-22",
    "city": "Barrow",
    "venue": "Tuzzy Consortium Library",
    "category": "community",
    "title": "Storytime & Crafternoon",
    "time": "1p-3p",
    "ticketUrl": "https://www.facebook.com/TuzzyConsortiumLibrary/",
    "cost": ""
  },
  {
    "id": "47220",
    "date": "2026-07-29",
    "city": "Barrow",
    "venue": "Tuzzy Consortium Library",
    "category": "community",
    "title": "Storytime & Crafternoon",
    "time": "1p-3p",
    "ticketUrl": "https://www.facebook.com/TuzzyConsortiumLibrary/",
    "cost": ""
  },
  {
    "id": "47381",
    "date": "2026-08-05",
    "city": "Barrow",
    "venue": "Tuzzy Consortium Library",
    "category": "community",
    "title": "Storytime & Crafternoon",
    "time": "1p-3p",
    "ticketUrl": "https://www.facebook.com/TuzzyConsortiumLibrary/",
    "cost": ""
  },
  {
    "id": "47582",
    "date": "2026-08-08",
    "city": "Barrow",
    "venue": "Tuzzy Consortium Library",
    "category": "community",
    "title": "Storytime & Crafternoon",
    "time": "1p-3p",
    "ticketUrl": "https://www.facebook.com/TuzzyConsortiumLibrary/",
    "cost": ""
  },
  {
    "id": "47748",
    "date": "2026-08-12",
    "city": "Barrow",
    "venue": "Tuzzy Consortium Library",
    "category": "community",
    "title": "Storytime & Crafternoon",
    "time": "1p-3p",
    "ticketUrl": "https://www.facebook.com/TuzzyConsortiumLibrary/",
    "cost": ""
  },
  {
    "id": "48008",
    "date": "2026-08-15",
    "city": "Barrow",
    "venue": "Tuzzy Consortium Library",
    "category": "community",
    "title": "Storytime & Crafternoon",
    "time": "1p-2p",
    "ticketUrl": "",
    "cost": ""
  },
  {
    "id": "48176",
    "date": "2026-08-19",
    "city": "Barrow",
    "venue": "Tuzzy Consortium Library",
    "category": "community",
    "title": "Storytime & Crafternoon",
    "time": "1p-2p",
    "ticketUrl": "https://www.tuzzy.org/home",
    "cost": ""
  },
  {
    "id": "48581",
    "date": "2026-08-26",
    "city": "Barrow",
    "venue": "Tuzzy Consortium Library",
    "category": "community",
    "title": "Storytime & Crafternoon",
    "time": "1p-2p",
    "ticketUrl": "https://www.tuzzy.org/home",
    "cost": ""
  },
  {
    "id": "48797",
    "date": "2026-09-02",
    "city": "Barrow",
    "venue": "Tuzzy Consortium Library",
    "category": "community",
    "title": "Storytime & Crafternoon",
    "time": "1p-2p",
    "ticketUrl": "https://www.tuzzy.org/home",
    "cost": ""
  },
  {
    "id": "48977",
    "date": "2026-09-09",
    "city": "Barrow",
    "venue": "Tuzzy Consortium Library",
    "category": "community",
    "title": "Storytime & Crafternoon",
    "time": "1p-2p",
    "ticketUrl": "https://www.tuzzy.org/home",
    "cost": ""
  },
  {
    "id": "49169",
    "date": "2026-09-16",
    "city": "Barrow",
    "venue": "Tuzzy Consortium Library",
    "category": "community",
    "title": "Storytime & Crafternoon",
    "time": "1p-2p",
    "ticketUrl": "https://www.tuzzy.org/home",
    "cost": ""
  },
  {
    "id": "49360",
    "date": "2026-09-23",
    "city": "Barrow",
    "venue": "Tuzzy Consortium Library",
    "category": "community",
    "title": "Storytime & Crafternoon",
    "time": "1p-2p",
    "ticketUrl": "https://www.tuzzy.org/home",
    "cost": ""
  },
  {
    "id": "49381",
    "date": "2026-09-23",
    "city": "Barrow",
    "venue": "Tuzzy Consortium Library",
    "category": "community",
    "title": "Vampires & Chicken Nuggets: A Thematic Book Club",
    "time": "6p-7p",
    "ticketUrl": "https://www.tuzzy.org/home",
    "cost": ""
  },
  {
    "id": "49555",
    "date": "2026-09-30",
    "city": "Barrow",
    "venue": "Tuzzy Consortium Library",
    "category": "community",
    "title": "Storytime & Crafternoon",
    "time": "1p-2p",
    "ticketUrl": "https://www.tuzzy.org/home",
    "cost": ""
  },
  {
    "id": "49742",
    "date": "2026-10-07",
    "city": "Barrow",
    "venue": "Tuzzy Consortium Library",
    "category": "community",
    "title": "Storytime & Crafternoon",
    "time": "1p-2p",
    "ticketUrl": "https://www.tuzzy.org/home",
    "cost": ""
  },
  {
    "id": "49927",
    "date": "2026-10-10",
    "city": "Barrow",
    "venue": "Tuzzy Consortium Library",
    "category": "community",
    "title": "Storytime & Crafternoon",
    "time": "1p-2p",
    "ticketUrl": "https://www.tuzzy.org/home",
    "cost": ""
  }
]