[
  {
    "id": "47922",
    "date": "2026-08-13",
    "city": "Trapper Creek",
    "venue": "Boots Bison Ranch",
    "category": "music",
    "title": "Trapper Creek Bluegrass Revival",
    "time": "TBD",
    "ticketUrl": "",
    "cost": ""
  },
  {
    "id": "47991",
    "date": "2026-08-14",
    "city": "Trapper Creek",
    "venue": "Boots Bison Ranch",
    "category": "music",
    "title": "Trapper Creek Bluegrass Revival",
    "time": "TBD",
    "ticketUrl": "",
    "cost": ""
  },
  {
    "id": "48080",
    "date": "2026-08-15",
    "city": "Trapper Creek",
    "venue": "Boots Bison Ranch",
    "category": "music",
    "title": "Trapper Creek Bluegrass Revival",
    "time": "TBD",
    "ticketUrl": "",
    "cost": ""
  },
  {
    "id": "48117",
    "date": "2026-08-16",
    "city": "Trapper Creek",
    "venue": "Boots Bison Ranch",
    "category": "music",
    "title": "Trapper Creek Bluegrass Revival",
    "time": "TBD",
    "ticketUrl": "",
    "cost": ""
  }
]